category,receipt word
2,"리치한 치즈프로스팅이 듬뿍 올라간 이번 당근머핀은      올리브유를 이용해 특유의 가벼운 느낌이 너무 잘 어울리는 머핀이랍니다.      가끔은 진한 크림치즈에 입이 즐거울 수 있도록 마음을 양보해 주세요.       달걀과 크림치즈는 실온 상태가 되도록 냉장고에서 꺼내 30분 이상 둔다.     당근은 채칼로 잘게 채 썬 다음 물기를 제거한다.     호두는 굵게 다진다.     머핀팬에 유산지를 깐다.     오븐은 180℃로 10분간 예열한다.   볼에 달걀을 넣고 손거품기로 가볍게 풀어준다.   흑설탕을 2~3번에 나눠 조금씩 넣어 가며 손거품기로 골고루 섞는다. 올리브유와 계핏가루를 체에 내려 손거품기로 섞는다.   박력분, 베이킹파우더를 체에 내려 넣고 실리콘 주걱으로 가볍게 섞는다.   채칼로 잘게 채 썬 당근과 굵게 다진 호두를 넣고 실리콘 주걱으로 골고루 섞는다.   유산지를 깔아둔 머핀틀에 반죽을 담고 180℃로 예열한 오븐에 20분간 구워서 식힘망에 얹어 식힌다.   다른 볼에 실온 상태의 크림치즈를 넣고 핸드믹서 거품기로 가장 약한 단계에서 부드러운 상태가 되도록 20초간 풀어준 다음 설탕을 넣고 핸드믹서 거품기로 가장 약한 단계에서 1~3분간 휘핑한다.   플레인요구르트를 넣고 핸드믹서 거품기의 가장 약한 단계에서 가볍게 풀어준다.   스패츌러를 이용해 머핀 윗면에 아이싱한다."
2,"부드러운 버터링쿠키에 홍차 향을 더해 입 안에서 홍차 향이 더욱 부드럽게 퍼지는 쿠키입니다.    홍차버터링쿠키 만으로도 충분하지만 홍차 향과 초콜릿은 너무나도    잘 어울리는 조화이기 때문에 초콜릿에 피스타치오를 뿌려 한 층 맛과 멋을 더했습니다.    가을의 분위기와 너무나도 잘 어울리는 홍차쿠키의 은은함을 따뜻한 우유 한잔과 함께 즐겨보세요.       버터와 달걀은 실온 상태가 되도록 냉장고에서 꺼내 30분 이상 둔다.     오븐은 180℃로 10분간 미리 예열한다.   볼에 실온상태의 버터를 넣고 핸드믹서 거품기로 가장 약한 단계에서 30초간 풀어준다.   설탕과 바닐라설탕, 소금을 2번에 나눠 조금씩 넣어 가며 부드러운 상태가 되도록 핸드믹서 거품기로 가장 약한 단계에서 2분간 휘핑한다.   실온 상태의 달걀 노른자를 넣고 핸드믹서 거품기로 가장 약한 단계에서 고운 크림 상태가 될 때까지 1분간 휘핑한다.   박력분을 체에 내려 넣고, 실리콘 주걱으로 가루가 보이지 않을 때까지 가볍게 섞는다.   홍차가루를 넣고 가볍게 섞는다.   별모양깍지를 끼운 짤주머니에 의 반죽을 담는다. 유산지를 깐 쿠키팬에 모양내어 짠 후, 180℃ 오븐에 12분간 굽는다.   완성된 쿠키는 식힘망에 올려 충분히 식힌다.   중탕으로 녹인 다크커버처 초콜릿에 쿠키 한쪽을 코팅한다. 초콜릿이 굳기 전에 다진 피스타치오를 올려 장식한다."
2,"사과가 맛있는 요즘 맛있는 사과를 이용한 매력적인 케이크를 소개합니다.    아삭거리는 사과와 향긋한 계피향이 느껴지는 부드럽고 촉촉한 케이크 입니다.    베이킹하기 좋은 계절 가을에 탐스러운 애플케이크를 만들어 보세요.       아몬드크림용 버터와 달걀은 실온에 30분 이상 둔다.     호두는 먹기 좋은 크기로 잘라놓는다.     원형 케이크틀에 유산지를 깐다.     오븐은 170℃로 10분간 미리 예열한다.   냄비에 얇게 저민 사과, 레몬즙, 설탕, 계핏가루를 넣고 3~5분간 조려서 식힌다. 조린 사과에 수분이 많을 경우 체에 거르면 반죽 안에서 더 잘 익습니다.   볼에 실온 상태의 버터를 넣고 핸드믹서의 거품기로 가장 약한 단계에서 부드러운 상태가 되도록 10초간 풀어 준다.    설탕과 바닐라설탕, 소금을 섞은 다음 조금씩 넣으며 부드러운 상태가 되도록 핸드믹서의 거품기로 가장 약한 단계에서 2분간 휘핑한다.   달걀을 2번에 나눠 넣으며 충분히 풀어지도록 1분씩 휘핑해 고운 크림 상태가 되도록 한다.   박력분과 베이킹파우더를 체에 내리고 실리콘 주걱으로 가볍게 섞어준다.   미리 준비한 호두를 넣고 실리콘 주걱으로 가볍게 섞는다.   유산지를 깔아둔 원형틀에 실리콘 주걱을 이용해 반죽을 넣는다. 실리콘 주걱을 이용해 윗면을 평평하게 한다.   의 케이크가 나오자마자 표면에 끓인 살구잼을 빵솔을 이용해 발라준다."
2,"고소한 통헤즐넛으로 장식해서 만든 헤즐넛쿠키를 소개해 드립니다.     모양도 예쁘고 맛도 좋아 남녀노소 누구나 좋아하는 쿠키 입니다.     나른한 오후에 커피 한잔에 헤즐넛쿠키로 피로를 날려버리세요.     감사한 마음을 담아 선물하기에도 아주 좋은 쿠키에요.       달걀과 버터는 실온 상태가 되도록 냉장고에서 꺼내 30분 이상 둔다.     쿠키팬에 유산지를 깐다.     오븐은 180℃로 10분간 미리 예열한다.   볼에 실온 상태의 버터를 넣고 핸드믹서 거품기의 가장 약한 단계에서 부드러운 상태가 되도록 30초간 풀어 준다.   설탕, 소금을 2~3번에 나눠 넣으며 핸드믹서 거품기로 가장 약한 단계에서 30초 가량 가볍게 섞는다.    계핏가루, 레몬껍질을 넣고 핸드믹서 거품기로 가장 약한 단계에서 30초간 가볍게 섞는다.   달걀 노른자를 넣고 핸드믹서 거품기의 가장 약한 단계에서 1분간 휘핑한다.   박력분과 아몬드가루를 체에 내린 후 실리콘 주걱으로 가볍게 섞는다.   반죽을 비닐에 넣고 돌돌 말아 원기둥 모양을 만든 다음 냉장고에 넣어 2시간 이상 휴지한다.   볼에 달걀 흰자를 넣고 핸드믹서 거품기로 가장 센 단계에서 20초간 풀어 준다.    거품이 풍성하게 일면 설탕을 조금씩 넣으며 단단한 거품이 되도록 핸드믹서 거품기의 가장 센 단계에서 2분간 휘핑한다.   아몬드가루를 체에 내려 넣고, 실리콘 주걱으로 가볍게 섞는다.    원형깍지를 끼운 짤주머니에 담는다.   의 머랭을 짜고, 그 위에 통헤즐넛을 올려 장식한다.    180℃로 예열한 오븐에 15분간 구워 식힘망에 얹고 식힌다."
2,"아몬드크림에서 느껴지는 밤 특유의 고소함과 달콤함으로 가을을 한껏 품은 타르트를 완성했습니다.    가을이 주는 선물인 밤을 이용해 만드는 타르트는 더 큰 선물이 될 수 있는 아이템입니다.    밤타르트를 만들어 풍성한 가을을 나눠보세요.       아몬드크림용 버터와 달걀은 실온에 30분 이상 둔다.     타르트틀에 철판이형제를 바른다.     오븐은 180℃로 10분간 미리 예열한다.   푸드프로세서에 박력분을 체쳐 내리고 설탕, 바닐라설탕, 소금을 넣고 가볍게 섞어준다.   푸드프로세서에 찬물과 차가운 버터를 깍둑썰기 해서 넣어 하나의 반죽이 되도록 섞는다.   완성된 반죽을 비닐에 넣고 손으로 눌러 가며 하나의 반죽 덩어리로 뭉친 후, 냉장고에 넣어 30분 정도 휴지한다.   휴지한 반죽을 두께 0.3cm 정도가 되도록 밀대로 편다. 철판이형제를 바른 타르트틀에 안쪽부터 손끝으로 눌러 가며 채워 넣는다.   포크로 바닥에 군데군데 구멍을 낸다. 180℃로 예열한 오븐에 넣어 12분간 구운 다음 식힘망에 얹어 충분히 식힌다.   볼에 마롱페이스트를 넣고 생크림을 조금씩 넣어가며 핸드믹서 거품기의 가장 약한 단계에서 휘핑한다.    럼주를 넣고 다시 한 번 가볍게 휘핑한다.   다른 볼에 버터를 넣고 핸드믹서 거품기의 가장 약한 단계에서 부드러운 상태가 될 때까지 풀어준다.    슈가파우더와 바닐라설탕을 2번에 나눠 넣으며 버터와 충분히 섞이도록 핸드믹서 거품기로 가장 약한 단계에서 휘핑한다.   달걀을 넣고 핸드믹서의 거품기로 가장 약한 단계에서 휘핑해 고운 크림상태로 만든다.   아몬드가루와 박력분을 체에 내려 넣고 실리콘 주걱으로 가볍게 섞는다. 마지막에 럼주를 넣고 다시 한 번 가볍게 섞어준다.   에 완성된 아몬드크림을 채우고 표면을 평평하게 정리한다. 보늬밤을 먹기 좋은 크기로 잘라서 올린 다음 180℃로 예열한 오븐에 35~40분간 굽는다."
2,"가끔 추억의 맛처럼 기억에 남아 문득 먹고 싶은 고구마케이크.    식이섬유소가 풍부하게 들어가 있는 가을 제철 고구마를 이용해서 기억 속 고구마 케이크를 만들어 보세요.    부드러운 크림에 녹아있는 달콤한 고구마맛은 누구나 좋아할 만한 간식거리가 될 수 있습니다.       달걀은 실온 상태가 되도록 냉장고에서 꺼내 30분 이상 둔다.     고구마는 미리 삶아 껍질을 까서 준비한다.     냄비에 물과 설탕을 넣고 끓인 뒤 한김 식으면 럼주를 넣어 시럽을 완성한다.     원형틀에 유산지를 깐다.     무스틀에 무스띠를 두른다.     오븐은 180℃로 10분간 미리 예열한다.   볼에 달걀 2개를 넣고 핸드믹서 거품기의 가장 센 단계에서 휘핑해 거품을 낸다. 큰 거품이 일어나면 설탕, 바닐라설탕을 2~3번에 나눠 넣으면서 휘핑한다.   반죽을 들어 올렸을 때 되직하게 떨어지면서 볼에 리본 모양으로 겹치면 완성된 것이다. 핸드믹서 거품기의 가장 약한 단계에서 기포를 정리한다.   박력분, 옥수수전분, 베이킹파우더를 체에 내려 넣고 실리콘 주걱으로 가볍게 재빨리 섞는다.   유산지를 깐 원형틀에 반죽을 채우고 180℃ 오븐에서 25분간 굽는다.   시트가 완전히 식으면 빵칼을 이용해 시트를 3단으로 자르고 시트 윗면에 시럽을 바른다.   볼에 미리 삶아서 준비한 고구마를 으깨어 넣고, 커스타드크림과 꿀을 넣고 핸드믹서 거품기의 가장 약한 단계에서 휘핑한다.    생크림을 조금씩 넣어가며 핸드믹서 거품기로 휘핑한다.   무스띠를 두른 무스틀에 에 남은 시트 한장을 곱게 갈아 케이크 윗면과 옆면에 붙인다.   피스타치오와 구운 고구마를 이용해 케이크를 장식한다."
2,"스콘은 담백한 맛으로 아침에 커피나 우유와 함께 간단히 즐기기에 좋은 메뉴입니다.     오늘의 스콘은 통밀을 넣어 고소함을 더하고 윗면에 직접 만든 캐러맬을 올려 고급스러운 맛을 추가했답니다.     캐러맬의 달콤 쌉싸름한 맛이 가미되어 있어 아침의 아메리카노와 즐기기 더욱 좋은 캐러맬넛트스콘.     내일 아침을 위해 오늘 저녁 스콘만들기에 도전해 보세요.       쿠키팬에 유산지를 깐다.     오븐은 180℃로 10분간 예열한다.   냄비에 물을 넣고 안쪽을 적신 다음 냄비에 설탕과 물을 넣고 중불에 올려 끓인다.   가장자리가 갈색으로 변하면 불을 끄고 따뜻한 생크림을 조금씩 넣으며 실리콘 주걱으로 골고루 섞어 캐러맬을 만들어 식힌다.   푸드프로세서에 강력분, 박력분, 통밀가루, 베이킹파우더, 소금을 넣고 가볍게 갈아준 다음, 차가운 버터를 깍둑썰기하여 넣고 고슬고슬한 상태가 될 때까지 갈아준다.   푸드프로세서에 의 캐러맬과 생크림을 넣고 하나의 반죽으로 뭉쳐준다.   반죽을 비닐에 올리고 호두, 마카다미아, 피스타치오를 넣고 손으로 눌러가며 하나의 반죽으로 뭉친 다음, 냉장고에 넣어 30분간 휴지시킨다.   휴지한 반죽을 두께 2cm가 되도록 밀대로 밀어 핀 다음, 지름 5cm 원형커터로 반죽을 찍어낸 다음 유산지를 깐 팬에 간격을 띄어 놓고 180℃로 예열한 오븐에 넣어 20분간 굽는다."
2,"잣은 불포화지방산이 함유되어있어 피부미용에 좋고 비타민E 성분은     항산화 작용이 뛰어나 노화를 막아주는 등 몸에 좋은 견과류 중 하나로 알려져 있습니다.     오늘의 타르트는 아몬드크림과 커스타드크림, 두 가지 필링의 조화가 잣과 너무나도 잘 어울리는 잣타르트.     기존에 타르트보다 색다른 맛을 원한다면 잣타르트에 도전해 보는것은 어떨까요.       버터와 달걀은 실온에 30분 이상 둔다.     타르트틀에 철판이형제를 바른다.     오븐은 180℃로 10분간 예열한다.   볼에 버터를 넣고 핸드믹서 거품기의 가장 약한 단계에서 부드러운 상태가 될 때까지 풀어준다.    슈가파우더와 바닐라설탕 소금을 조금씩 넣으며 버터와 충분히 섞이도록 핸드믹서 거품기로 가장 약한 단계에서 휘핑한다.   실온상태의 달걀 노른자를 넣고 핸드믹서 거품기로 휘핑해 고운 크림상태를 만든다.   박력분을 체에 내려 넣고 실리콘 주걱으로 가볍게 섞는다.   완성된 반죽을 비닐에 넣고 손으로 눌러 가며 하나의 반죽 덩어리로 뭉친 후, 냉장고에 넣어 30분 정도 휴지한다.   휴지한 반죽을 두께 0.3cm 정도가 되도록 밀대로 편다. 철판이형제를 바른 타르트틀에 안쪽부터 손끝으로 눌러 가며 채워 넣는다.   포크로 바닥에 군데군데 구멍을 낸다. 180℃로 예열한 오븐에 넣어 12분간 구운 다음 식힘망에 얹어 충분히 식힌다.   커스터드크림용 우유와 박력분을 섞어준 뒤, 체에 걸러가며 냄비에 넣는다.   냄비를 중불에 올리고 눌러 붙지 않도록 실리콘 주걱으로 저어가며 끓인다. 설탕을 넣고 보글보글 끓을 때까지 끓인 다음 불에서 내린다.   달걀 노른자를 넣고 실리콘 주걱으로 섞는다. 완성된 커스터드크림은 공기에 닿지 않도록 표면에 랩을 밀착시킨 후 냉장고에 넣어 차갑게 식힌다.   볼에 아몬드크림용 버터를 넣고 핸드믹서 거품기의 가장 약한 단계에서 부드러운 상태가 될 때까지 풀어준다.    슈가파우더와 바닐라설탕을 넣고 핸드믹서 거품기로 휘핑한다.    실온상태의 달걀을 넣고 풀어준 뒤 아몬드가루를 넣고 핸드믹서 거품기로 가장 약한 단계에서 가볍게 휘핑한다.   충분히 식은 의 아몬드 크림을 올린다.   잣을 올린 뒤 170℃로 예열한 오븐에 30~35분간 굽는다."
2,달고 굵은 밤을 뜻하는 마론위에 올린다.   시트를 안쪽에서부터 둥글려가며 말아준 다음 유산지에 싸서 냉장고에 넣어 30분간 차갑게 식힌다.
2,"키쉬는 식사대용으로 먹을 수 있는 파이입니다.    오늘은 요즘 맛있는 감자를 듬뿍 넣은 키쉬를 준비했습니다.    브런치로 손색없은 키쉬를 만들어 맛있는 오전 시간의 여유를 가져보세요.       감자는 미리 삶아서 준비한다.     타르트틀에 철판이형제를 바른다.     오븐은 180℃로 10분간 예열한다.   푸드프로세서에 박력분, 달걀 노른자, 소금, 차가운 버터를 깍둑썰기하여 넣고 가장 센 단계에서 10초간 돌리다가 재료가 섞이면 찬물을 넣고 15초간 더 돌린다.   반죽이 뭉쳐지면 비닐봉투에 담아 냉장고에 넣어 1시간 이상 휴지시킨다.   휴지한 반죽을 두께 0.3cm 정도가 되도록 밀대로 편다. 철판이형제를 바른 타르트틀에 안쪽부터 손끝으로 눌러 가며 채워 넣고, 포크로 바닥에 군데군데 구멍을 낸다. 180℃로 예열한 오븐에 넣어 12~15분간 굽는다.   미리 준비한 감자와 베이컨은 먹기 좋은 크기로 잘라서 준비한다.   위에 필링을 붓는다.   피자치즈와 파슬리가루를 뿌리고 180℃로 예열한 오븐에 넣어 30분간 굽는다."
2,"백앙금의 달콤함에 아몬드가루의 고소함을 더한 상투과자는 만들기도 어렵지 않고 가볍게 즐길 수 있는 간식거리입니다.    상투과자가 일본에서 우리나라로 처음 들어왔을 때는 '구리볼'로 알려지다가    상투와 모양이 비슷하다하여 상투과자라고 불리우기 시작했다고 합니다.    이제는 색과 맛도 여러가지인 변화무쌍한 상투과자를 손쉽게 만들어 보세요.       백앙금은 실온상태로 준비한다.     쿠키팬에 유산지를 깐다.     짤주머니에 깍지를 넣어 준비한다.     오븐은 180℃로 10분간 예열한다.   볼에 실온 상태의 흰 팥앙금을 넣고 핸드믹서 거품기로 가장 약한 단계에서 부드러운 상태가 되도록 30초간 풀어준다.   아몬드가루를 덩어리지지 않도록 손으로 쳐가며 체에 내린다.   생크림과 물엿을 넣고 핸드믹서 거품기로 가장 약한 단계에서 30초간 가볍게 섞어 되직한 상태의 반죽을 완성한다.   반죽을 3등분 하여 각각 녹차가루, 백년초가루, 호박가루를 체에 내린다. 핸드믹서 거품기로 20초간 가볍게 섞어 반죽을 완성한다.   모양깍지를 끼운 짤주머니에 각각의 반죽을 넣는다.   유산지를 깐 팬에 상투과자 모양을 만들며 각각의 반죽을 짠 다음 180℃로 예열한 오븐에 넣어 15분간 굽는다."
2,"달콤한 밤과 함께 구워낸 보늬밤 파운드케이크는 부드러운 식감과 함께 고급스러운 맛을 자랑하는 케이크입니다.    파운드케이크는 선물용으로 많이 찾는 아이템이죠.    이번 추석때는 내 손으로 직접 만든 파운드케이크를 선물해 보시는건 어떠세요?       버터, 달걀, 우유는 실온 상태가 되도록 냉장고에서 꺼내 30분 이상 둔다.     파운드케이크틀에 철판이형제를 바른다.     오븐은 180℃로 15분간 예열한다.   볼에 실온 상태의 버터를 넣고 핸드믹서의 거품기로 가장 약한 단계에서 부드러운 상태가 되도록 10초간 풀어준다.   메이플시럽과 바닐라 설탕을 넣고 부드러운 상태가 되도록 핸드믹서의 거품기로 가장 약한 단계에서 2분간 휘핑한다.   달걀은 1개씩 넣으며 충분히 풀어지도록 1분씩 휘핑해 고운 크림 상태가 되도록 한다.   밤페이스트를 넣고 부드러운 상태가 되도록 핸드믹서의 거품기로 가장 약한 단계에서 1분간 휘핑한다.   박력분과 아몬드가루, 베이킹파우더를 체에 내리고 실리콘 주걱으로 가볍게 섞어준다. 우유를 넣고 실리콘 주걱으로 가볍게 섞어준다.   파운드 틀에 반죽을 넣고 윗면을 평평하게 한 다음, 미리 준비해둔 보늬밤을 파운드 위에 얹고 예열한 170℃ 오븐에 30~40분간 굽는다."
2,"몸에 좋은 견과류들의 반란.    견과류를 캐러맬과 함께 타르트 위에 듬뿍 올렸습니다.    캐러맬과 함께 견과류의 고소함을 극대화시킨 타르트죠.    한 번 맛본다면 한 번쯤은 달콤하게 견과류를 즐기는 것도 나쁘지 않다는 것을 느낄 수 있을 거예요.       버터와 달걀은 실온에 30분 이상 둔다.     타르트틀에 철판이형제를 바른다.     오븐은 180℃로 10분간 예열한다.   볼에 버터를 넣고 핸드믹서 거품기의 가장 약한 단계에서 부드러운 상태가 될 때까지 풀어준다.    슈가파우더와 바닐라설탕 소금을 조금씩 넣으며 버터와 충분히 섞이도록 핸드믹서 거품기로 가장 약한 단계에서 휘핑한다.   실온상태의 달걀 노른자에 인스턴트 커피를 가볍게 풀어준 뒤, 의 타르트에 속재료를 넣어 완성한다."
2,"고소한 호두가 달콤한 백앙금과 잘 어울어지는 밤과자는 부드러운 식감으로 어른들이 좋아하시는 간식거리입니다.    고소하고 담백한 맛을 내는 밤과자는 만든 만큼 보람이 있는 아이템이죠.     추석 선물용으로도 손색이 없는 밤과자를 만들어 마음을 담은 선물을 준비하세요.       버터, 달걀은 실온 상태가 되도록 냉장고에서 꺼내 30분 이상 둔다.     쿠키팬에 유산지를 깐다.     오븐은 170℃로 10분간 예열한다.   볼에 실온 상태의 버터를 넣고 핸드믹서 거품기의 가장 약한 단계에서 부드러운 상태가 될 때까지 풀어준다.    설탕을 넣고 핸드믹서의 거품기로 가장 약한 단계에서 30초간 휘핑한다.   실온상태의 달걀을 넣고 핸드믹서의 거품기로 휘핑해 고운 크림상태로 만든다.    물엿과 연유를 넣고 핸드믹서의 거품기로 가볍게 섞는다.   박력분과 아몬드가루, 베이킹소다를 체에 내려 넣고 실리콘 주걱으로 가볍게 섞는다.   반죽을 비닐에 넣고 냉장고에서 1시간 이상 휴지한다.   1시간 이상 휴지시킨 반죽을 30g씩 나누고 동그랗게 빚는다.   비닐 사이에 반죽을 넣고 밀대로 동그랗게 반죽을 밀어 편다.   흰앙금은 25g씩 분할해 동그랗게 빚어 윗면에 골고루 바른다.   호두와 해바라기씨를 얹은 뒤, 170℃로 예열한 오븐에 12~15분간 굽는다."
2,"만들기 쉬운 밤양갱과 녹차양갱을 만들어 가족들의 간식을 책임져 보세요.    가족들이 다 모인 명절 날 어른들부터 아이들까지  모두의 입맛을    만족 시킬 달콤한 양갱으로 달콤한 시간을 완성해 보세요.      밤통조림의 밤은 물기를 빼서 준비한다.   물에 한천가루를 넣고 10분 동안 불려준다. 냄비에 불린 한천가루를 넣고 중불에서 가볍게 끓여준다.   설탕, 소금을 넣고 다시 한 번 중불에서 가볍게 끓여 준다.   끓어오르면 단팥을 넣고 실리콘 주걱으로 잘 풀어준다.   냄비를 불에서 내린 다음 물엿을 넣고 실리콘 주걱으로 가볍게 섞어준다.   양갱몰드에 밤을 깔아준다.   밤을 깔아 놓은 틀에 를 채워 넣은 뒤 서늘한 곳에서 굳힌다."
2,"복숭아를 블루베리와 라즈베리등 달콤한 베리류와 함께 무스의 부드러움을 즐길 수 있는 떠먹는 무스케이크 입니다.     다양한 맛을 한입에서 맛볼 수 있는 매력적인 아이템입니다.       냄비에 물, 설탕을 넣어 끓이고 차갑게 식힌 후 럼주를 넣어 시럽을 완성한다.     크림치즈와 사워크림은 실온상태가 되도록 냉장고에서 꺼내 30분 이상 둔다.     장식용 건조크랜베리와 건조블루베리는 럼주에 절인다.     복숭아통조림에 복숭아를 곱게 갈아 복숭아 퓨레를 만든다.   디저트컵에 시판용 시트를 2장씩 찍어 준비한다. 디저트컵에 준비한 시트 1장을 깔아준다.   시트에 미리 만들어 둔 시럽을 빵솔로 발라준다.   볼에 실온 상태의 크림치즈를 넣고 핸드믹서 거품기로 가장 약한 단계에서 크림상태가 되도록 20초간 풀어 준다.   설탕과 바닐라 설탕을 넣고 핸드믹서 거품기로 가장 약한 단계에서 10초간 풀어 준다.   복숭아퓨레를 넣고 핸드믹서 거품기로 가장 약한 단계에서 가볍게 풀어 준다.      다른 볼에 생크림을 넣고 핸드믹서 거품기의 가장 센 단계에서 부드러운 소프트아이스크림 상태가 될 때까지 거품을 내고, 오렌지술을 넣는다.   의 볼에 휘핑한 생크림을 2~3번에 나누어 넣고 실리콘 주걱으로 가볍게 섞어준다.   시트를 깔아 준비한 디저트 컵에 6의 필링을 1/2씩 넣는다.   필링 위에 장식용 크랜베리와 블루베리, 복숭아를 올린다.   미리 준비한 시트 1장을 올린다.   나머지 필링을 붓고 스크래퍼로 표면을 평평하게 정리한다."
