category,receipt word
1,"쫄깃쫄깃 몰캉몰캉한 꼬막에 아삭한 양배추와 양파를 넣어 달콤한 양념에 무쳐냈어요. 골뱅이보다 더 쫄깃하고 맛이 풍부한 꼬막을 삶아 살만 발라냈더니 먹기도 편하네요. 은은한 깻잎 향에 입도 개운해진답니다.       꼬막에 담가  빛이 들어오지 않도록 2시간 정도  해감한 뒤 비벼가며 깨끗이 헹구고,   냄비에 물을 넉넉히 넣고 기포가  올라오기 시작하면 꼬막을 넣어  한 방향으로 저어가며 익히다가  껍질이 벌어지기 시작하면 불을 끄고,   체에 건져 한 김 식힌 뒤 살만  발라내고,   양배추와 양파, 깻잎은 채 썰고,은 섞고,   볼에 꼬막살과 양념장을 넣고  버무린 뒤 채소를 넣어 한 번 더  버무려 마무리."
1,"토마토에 많은 베타카로틴 성분은 우리 몸에 들어오면  지용성 비타민A로 바뀌기 때문에 기름과 함께 조리해 먹는 것이 좋아요. 토마토와 버섯을 금세 볶아 만든 초간단 반찬을 소개합니다.       새송이버섯을 중약 불로 볶아  향을 낸 뒤 버섯을 넣어 볶고,   버섯의 숨이 죽기 시작하면  토마토를 넣어 뒤적인 뒤  나머지 을 넣고  쪽파를 뿌려 마무리."
1,"칼로리가 낮아 다이어트에 좋은 토마토. 살짝 익힌 방울토마토의 껍질을 제거해 부드럽게 즐길 수 있는 샐러드예요. 새콤한 식초드레싱에 버무려 차게 해서 먹으면 여름철 샐러드로 제격이죠.       방울토마토로 칼집을 내  끓는 물에 데친 뒤  찬물에 헹궈 껍질을 벗기고,   파인애플은 작게 썰고,   볼에 모든 재료를 담고  살살 버무려 마무리."
1,"튀일은 견과류가 울퉁불퉁하게 박힌 기와장 모양의 프랑스 과자예요. 프라이팬에 반죽을 최대한 얇게 펴서 굽는 게 포인트죠. 부드럽게 씹히는 이밥차식 튀일, 오븐 없이도 맛있게 만들어요.       달걀흰자를 두르고  키친타월로 닦은 뒤 약한 불로 줄여  반죽을 지름 6cm 크기로 얇게 펴 올리고  가장자리가 진한 갈색이 되면  뒤집어서 3~4분간 더 익히고,   밀대에 말아 1~2분간 두어  기와장 모양이 되면   완전히 식혀 마무리."
1,"떡도 아니고 빵도 아닌 것이 고소하고 쫄깃해 중독성 있는 팬케이크예요. 달콤하게 조린 밤이나 마른과일을 넣으면 더 맛있어요.       찹쌀가루를  두르고 키친타월로 닦아낸 뒤  반죽을 올려 얇게 펴고,   뚜껑을 닫고 약한 불에서 앞뒤로  노릇하게 익히고 먹기 좋은 크기로  썰어 마무리."
1,"더위로 입맛이 없을 땐 보리밥에 열무김치와 고추장을 넣고 쓱쓱 비벼보세요. 통통한 보리밥알과 시원한 열무김치가 잘 어울린답니다. 양푼에 넣고 비벼 여럿이 함께 먹으면 즐거움이 두 배가 되죠.       열무김치를 넣고 섞은 뒤 열무와 양파, 쪽파를 넣고 살살 버무려 마무리."
1,"얇고 부드러운 크레이프에 달콤한 바나나와 초코칩을 넣으니 근사한 크레이프가 뚝딱 완성됐어요. 생크림과 과일을 듬뿍 넣어 나만의 크레이프를 만들어보세요.       바나나를  두르고 키친타월로 닦아 코팅한 뒤  반죽을 올려 얇게 펴 부치고,   노릇하게 부친 크레이프를  한김 식힌 뒤 휘핑한 생크림과  바나나, 초코칩, 슬라이스 아몬드를  넣고 접어서 마무리."
1,여름철이면 더욱 생각나는 시원한 오징어물회.신선한 오징어를 곱게 채 썰어 채소와 함께 담고 얼음을 동동 띄워 드셔보세요.입 안은 물론 속까지 시원해질 거예요.       다시마에 을 섞고   그릇에 채소를 돌려 담고  오징어를 얹은 뒤 국물을 붓고  무순을 얹어 마무리.
1,"언제나 볶음밥, 달걀, 케첩으로 완성되는 홈메이드 오므라이스가 조금 지겨운가요? 밥에 넣는 재료와 양념만 약간 바꿔도 멋지게 변신해요. 매콤한 맛을 더하니 어른들 입맛에도 잘 맞는답니다. 냉장고 속 다양한 채소를 다져 넣거나, 샐러드를 곁들여 근사하게 즐겨보세요.       가지를 두르고  달걀물을 넓게 부어 익히고,   반 이상 익으면 중앙에 밥을 얹고  양쪽 가장자리의 달걀을 접어  모양을 만들고 그릇에 뒤집어  담아 마무리."
1,"날이 더워질수록 뜨거운 국물은 만들기도 먹기도 귀찮죠. 하지만 국물이 없으면 밥이 안 넘어가는 천상 한국인이라면 간단한 냉국으로 입맛을 돋워보세요. 가지는 혈중 콜레스테롤을 낮추는 효과도 있어 건강에 좋답니다.       가지에 을  섞고 가지 무침과 쪽파,  통깨, 얼음을 넣어 마무리."
1,"입맛 살려주는 새콤달콤한 양념장에 향긋한 미나리와 쫄깃한 버섯을 조물조물 무쳐냈어요.    밑반찬으로 집어 먹어도 좋지만 따뜻한 밥에 얹어 쓱쓱 비벼 먹어야 제대로! 구수한 된장국을 곁들여 먹으면 더욱 좋아요.      미나리을 넣은 뒤  표고버섯, 애느타리버섯을  각각 넣고 살짝 데쳐 건진 뒤  찬물에 헹궈 물기를 짜고, 을 만들고,   볼에 양념장과 버섯을 넣어  버무린 뒤 미나리를 넣고  가볍게 버무리고,   그릇에 밥을 담은 뒤  미나리버섯무침을 올리고  볶은 참깨를 뿌려 마무리."
1,"된장으로 돼지고기 누린내를 잡고 미트소스와 구운 가지를 겹겹이 쌓아 모차렐라치즈로 마무리했어요. 숟가락으로 푹푹 퍼 먹으면 몽글몽글 씹히는 돼지고기와 말랑말랑한 가지, 쭈욱 늘어나는 고소한 치즈가 입에서 살살 녹네요. 노릇노릇하게 구워진 모양이 손님상에도 잘 어울려요.       다진 돼지고기를 섞고,   오븐용기에 가지와 돼지고기볶음을  층층이 쌓아 담은 뒤 치즈를 뿌려  200℃로 예열한 오븐에서 10분 정도  구워 마무리."
1,"풍성하게 채운 접시만 봐도 배가 부른 영국식 아침식사예요.   종류가 많아서 어려울 것 같지만 사실 굽고 데우고 담으면 끝!   잉글리시 브렉퍼스트로 영국에 온 기분을 느껴보세요.       토마토를 두르고  달걀을 프라이한 뒤 칼집 넣은  소시지와 베이컨을 노릇하게  구워 건지고,   키친타월로 팬을 닦아  통조림 콩을 살짝 데우고, 통조림 콩은 토마토소스에 콩을 넣고 삶은 것으로 대형마트에서 구입할 수 있어요.   토마토와 어린잎채소를  드레싱에 버무리고  모든 재료를 접시에  고루 담아 마무리. 취향에 따라 토스트한 빵에 버터를 곁들여도 좋아요."
1,"청양고추를 넣어 칼칼하게 입맛 당기는 닭갈비를 만들어봤어요.   깻잎을 듬뿍 넣어 향을 내고 당면사리까지 넣으니 전문점 부럽지 않아요.   밥에 얹어 한그릇 요리로 즐겨보세요.       양파를  두르고 닭가슴살과 양파를  볶아 고기가 어느 정도  익으면 당면을 넣어 볶고, 고구마를 작게 썰어 넣어도 달콤하고 맛있어요.   당면에 간이 배면 깻잎을  넣고 뒤적인 뒤 불을 끄고   밥에 얹어 마무리."
1,비교적 저렴한 돼지등뼈에 맛있는 햇감자를 넉넉히 넣어 푸짐한 저녁식사를 준비해보세요.   불린 백태를 갈아서 국물에 넣었더니 영양도 듬뿍이에요.      백태를 넣고  5분 정도 더 끓여 마무리. 깻잎은 굵게 채 썰어 넣어요.
1,"한입에 쏙 들어가는 알감자를 매콤 달콤한 고추장양념에 버무렸어요.    껍질째 조리해 씹는 맛이 좋고 도시락 반찬으로도 그만이에요.    이번 주 우리집 밑반찬으로 어때요?      알감자를 두르고  알감자를 넣어 센불에서  껍질이 쭈글쭈글해질 때까지 볶고,   중약 불로 줄여 양념장을 넣고  고루 섞은 뒤 불을 끄고 호두를 섞고  통깨를 뿌려 마무리"
1,"밀가루 반죽으로 도우 만들기가 부담스러웠다면 햇감자를 이용해보세요.    가늘게 채 썬 감자와 양파, 피망을 볶아 동그란 모양으로 만든 뒤    치즈와 토핑을 얹으면 금세 맛있는 감자채피자가 완성돼요.    달걀 프라이까지 하나 올렸더니 한 끼 식사로도 든든하네요.      감자, 소금, 후춧가루를 넣고  한번 더 볶아 마무리."
1,"동의보감에 따르면 장어는 오장육부를 보하는 기특한 식품으로 허약한 체질에 매우 좋다고 해요.맛있게 양념한 장어와 소화를 돕는 생강까지 곁들여 보양 음식으로는 그만이죠.      손질된 장어   장어는 2~3등분하여 에  재워 두고,   키친타월로 장어의 물기를  닦아낸 뒤 식용유 두른 팬에  살짝 굽고,   구운 장어를 김 오른 찜통에  넣어 15~20분 정도 찌고,   김은 길게 자르고,  생강은 곱게 채 썰어  찬물에 헹구고,  쪽파는 송송 썰고,   팬에  재료를 넣고  끓으면 약한 불로 줄여  반으로 줄어들도록 졸이고,   달군 팬에 찐 장어를 넣고  중불에 양념장을 발라 가며  구워 한입 크기로 썰고 그릇에  밥과 장어, 김, 생강, 쪽파와 함께  담아 마무리."
1,"장어는 가격도 부담스럽고 익숙하지 않아 집에서 자주 요리하는 재료는 아니죠. 구이 대신 몸보신도 되고 맛까지 특별한 깐풍기로 만들어보세요. 장어 좋아하던 사람은 더 맛있게 먹고, 안 먹던 사람도 자꾸 손이 가네요.    손질한 장어를 두르고 마늘, 생강으로 향을 낸 뒤 붉은고추와 파를 넣고 볶다가을 넣어 끓이고,  장어를 넣어 물기가 없어질 때까지 볶고 풋고추와 참기름을 넣고 버무려 마무리."
1,"요즘 나온 햇양파는 아삭아삭 달큰한 맛이 일품이에요. 이 양파장아찌 한 번 담가 두면 한동안은 반찬 걱정 없어요. 양파장아찌 담가 두었던 간장은 고기, 샐러드채소 등에 두루두루 활용하세요.    햇양파  햇양파는 껍질을 까 십자로 썰고, 을 끓이고,  끓는 절임물을 양파에 붓고,  한 김 식혀 뚜껑 닫아 반나절 실온에 두었다가 3일 정도 냉장 보관 후 드세요."
1,"도토리묵무침에서 재료 하나만 살짝 바꾸니 훌륭한 두부 반찬이 탄생했어요.묵보다 더 배부르고 부드러워 자꾸만 먹고 싶어요.  깻잎이나 치커리, 쑥 등의 알싸하고 매운 향이 있는 잎채소를 더하면 담백한 두부와 잘 어울려요.     두부 은 섞고,  두부는 끓는 물에 데친 뒤 식혀 한입 크기로 썰고,  상추는 먹기 좋은 크기로 썰고, 오이는 얇게 썰고, 양파는 채 썰고,  채소와 양념장을 버무린 뒤 두부를 넣고 살살 섞어 마무리."
1,"영양 많고 고소한 콩가루를 부추에 묻혀 찜통에 살짝 쪄내면 부추가 거짓말처럼 부드러워져요. 양념장에 가볍게 버무리면 간단한 웰빙 반찬 완성!      부추와  부추를 넣고 흔들어 부추에  콩가루옷을 입히고,   김 오른 찜통에 젖은 면포를  깔고 중간 불에 부추를  5분간 찌고,   한 김 식으면 양념장에  버무려 마무리."
2,"칼로리 부담 없이 다이어트에 안성맞춤이에요.상큼한 토마토와 마늘종의 매콤한 맛이 잘 어울려요.    방울토마토로 칼집을 내 크림치즈를 채워 넣고,  마늘종은 10cm 길이로 준비하고,  방울토마토 끝에 마늘종을 꽂고, 을 만들고,  그릇에 담아 바질 잎으로 장식하고 발사믹드레싱을 곁들여 마무리."
2,"매일 먹던 밑반찬도 재료를 바꾸거나 양념을 다르게 하면 색다른 메뉴가 탄생한답니다. 한번 먹어보면 그 맛에 반해 평범한 참외가 심심하게 느껴질 정도예요. 달콤하고 아삭하면서 매콤한 양념 덕분에 비빔밥이나 쌈으로 먹어도 좋고 국수에 올려도 맛있어요.    참외  참외는 길게 반 갈라 속씨를 긁어낸 뒤 얇게 썰고,  쪽파는 송송 썰고,  참외를 에 무친 뒤 쪽파를 넣고 살짝 버무려 마무리."
2,"부드러운 쿠키반죽을 2가지 색으로 멋을 낸 바닐라 초코쿠키.    모양과 맛 모두 멋스러워 만드는 보람과 함께 받는 사람에게 즐거움과 감동을 줄 수 있는 쿠키입니다.    쿠키 위에 올라가는 아몬드는 부드러운 쿠키와 함께 고소하면서 씹는 식감을 더해줍니다.       버터와 달걀은 실온 상태가 되도록 냉장고에서 꺼내 30분 이상 둔다.     쿠키팬에 유산지를 깐다.     오븐은 180℃로 10분간 미리 예열한다.   볼에 실온상태의 버터를 넣고 핸드믹서의 거품기로 가장 약한 단계에서 부드러운 상태가 되도록 30초간 풀어준다.   슈가파우더, 바닐라설탕, 소금을 섞어 두 세번에 나누어 넣으며 버터와 충분히 섞이도록 핸드믹서 거품기로 가장 약한 단계에서 1분간 휘핑한다.   달걀 노른자를 넣고 핸드믹서 거품기로 가장 약한 단계에서 1분간 휘핑해 고운 크림 상태로 만든다.   볼에 반죽을 ½씩 나누어 담고 한 쪽 볼에 박력분 100g, 다른 볼에는 박력분 80g과 코코아가루 20g을 체에 내려 넣는다.   가루가 살짝 보일 정도로 실리콘 주걱으로 가볍게 섞는다.   반죽을 각각 비닐봉투에 담고 손으로 눌러가며 하나의 반죽 덩어리로 뭉친 다음 냉장고에 30분 정도 휴지시킨다.   바닐라반죽과 초코 반죽 모두 두께 0.5cm가 되도록 밀대로 얇게 민다.   각각의 반죽을 가로*세로 6*20cm 의 직사각형으로 잘라서 준비한다.   기본반죽 위에 붓을 이용해 흰자를 바르고 초코 반죽을 올려 놓는다.    반죽 위에 붓을 이용해 흰자를 바른 뒤 아몬드분태를 충분히 올린다. 반죽을 냉장고에 넣어 1시간 이상 휴지시킨다.   냉장고에서 휴지시킨 반죽을 꺼내 0.5cm 두께로 썬다.   유산지를 깐 쿠키팬에 서로 붙지 않도록 일정한 간격을 두어 올리고 180℃로 예열한 오븐에 12~15분간 굽는다."
2,"마들렌은 레몬향을 곁들여서 만들어 먹는 경우가 많죠.    오늘은 유자향이 물씬나는 부드러운 마들렌을 소개합니다.    촉촉한 마들렌은 겨울철 선물용으로도 좋은 아이템입니다.       달걀은 실온에서 30분이상 둔다.     버터는 전자레인지에 30초 녹인다.     오븐은 170℃로 10분간 예열한다.   볼에 실온 상태의 달걀을 넣고 손거품기로 10초간 가볍게 풀어준다.   설탕과 소금, 바닐라설탕을 넣고 손거품기로 가볍게 섞는다.   유자청을 넣고 손거품기로 가볍게 섞는다.   박력분과 아몬드가루, 베이킹파우더를 체에 내려 넣고 손거품기로 가볍게 섞는다.   녹인버터를 넣고 손거품기로 가볍게 섞는다.   랩을 씌워 냉장고에서 하루 정도 휴지시킨다.   마들렌 틀에 철판이형제를 바른다.   의 반죽을 짤주머니에 담아 마들렌 틀에 80% 정도 담은 후, 170℃로 예열한 오븐에 넣어 12분간 굽는다."
2,"겨울은 유자의 향긋한 향이 생각나는 계절입니다.    오늘 만드는 쿠키에는 유자청을 이용해 유자향을 더해 누구나 맛있게 먹을 수 있는 쿠키를 만들었습니다.       버터와 달걀은 실온 상태가 되도록 냉장고에서 꺼내 30분 이상 둔다.     호두는 먹기 좋은 크기로 다져서 준비한다.     쿠키팬에 유산지를 깐다.     오븐은 180℃로 10분간 미리 예열한다.   볼에 실온상태의 버터를 넣고 핸드믹서의 거품기로 가장 약한 단계에서 부드러운 상태가 되도록 30초간 풀어준다.   유자청과 꿀, 바닐라설탕을 넣고 버터와 충분히 섞이도록 핸드믹서 거품기로 가장 약한 단계에서 1분간 휘핑한다.   달걀 노른자를 넣고 핸드믹서 거품기로 가장 약한 단계에서 1분간 휘핑해 고운 크림 상태로 만든다.   박력분과 베이킹파우더를 체에 내려 넣고 실리콘 주걱으로 가볍게 섞는다.   다진 호두를 넣은 뒤 실리콘 주걱으로 가볍게 섞는다.   반죽을 숟가락으로 떠서 유산지를 깐 쿠키팬에 모양을 내어 올린다. 180℃로 예열한 오븐에 12~15분간 굽는다."
2,"장미를 닮은 쿠키를 2가지 색으로 멋을 냈습니다.    슈가파우더가 들어가 부드럽고, 딸기파우더의 달콤한 딸기 향이 묻어있는 쿠키입니다.    가나슈가 샌딩되어 있어 달콤함을 두배로 즐기실 수 있습니다.    마음을 담은 쿠키선물이 필요할 때 투톤로즈쿠키를 만들어보세요.       버터와 달걀 흰자는 실온 상태가 되도록 냉장고에서 꺼내 30분 이상 둔다.     쿠키팬에 유산지를 깐다.     오븐은 180℃로 10분간 미리 예열한다.   볼에 실온상태의 버터를 넣고 핸드믹서의 거품기로 가장 약한 단계에서 부드러운 상태가 되도록 30초간 풀어준다.   슈가파우더, 바닐라설탕, 소금을 섞어 두 세번에 나누어 넣으며 버터와 충분히 섞이도록 핸드믹서 거품기로 가장 약한 단계에서 1분간 휘핑한다.   달걀 흰자를 넣고 핸드믹서 거품기로 가장 약한 단계에서 1분간 휘핑해 고운 크림 상태로 만든다.   박력분을 체쳐 넣고, 실리콘 주걱으로 가볍게 섞는다.   다른 볼에 반죽을 ½ 나누어 담고 한 쪽 볼에 딸기파우더를 체쳐 내린 뒤 실리콘 주걱으로 가볍게 섞는다.   장미모양 깍지를 끼운 짤주머니에 흰 반죽과 딸기 반죽을 각각 담는다.    유산지를 깐 쿠키팬에 모양내어 짠 후, 미리 예열한 180℃오븐에 12분간 굽는다.   냄비에 생크림을 넣어 중불에 올리고 냄비 가장자리가 끓어오르면 불에서 내린다.   다크커버처 초콜릿을 넣고 녹을 때 까지 실리콘 주걱으로 섞는다. 완성된 초코크림은 실온에서 식힌다.   완성된 의 가나슈크림을 바르고 쿠키를 마주 붙여 완성한다."
2,"시나몬 가루는 차가워진 날씨와 어울리는 베이킹 재료 중 하나입니다.     쌀쌀해진 날씨에 따뜻한 커피한잔과 함께 달콤하면서도 은은향 향을 즐길 수 있는 시나몬롤 쿠키.    모양도 독특해 선물하기에도 좋은 아이템입니다.       버터와 플레인요구르트는 실온 상태가 되도록 냉장고에서 꺼내 30분 이상 둔다.     쿠키팬에 유산지를 깐다.     오븐은 180℃로 10분간 미리 예열한다.   볼에 실온상태의 버터를 넣고 핸드믹서의 거품기로 가장 약한 단계에서 부드러운 상태가 될 때까지 풀어준다.   설탕과 바닐라설탕, 소금을 섞어 조금씩 넣으며 핸드믹서의 거품기로 가장 약한 단계에서 30초간 휘핑한다.   실온상태의 플레인요구르트를 넣고 핸드믹서의 거품기로 휘핑해 고운 크림상태로 만든다.   박력분과 베이킹파우더를 체에 내려 넣고 실리콘 주걱으로 가볍게 섞는다.   뭉친 반죽은 냉장고에 넣어 30분간 휴지시킨다.   휴지한 반죽을 두께 0.5cm가 되도록 밀대로 얇게 민다.   장식용 설탕과 시나몬가루를 섞어 반죽 위에 골고루 뿌려준다.   반죽을 안쪽에서부터 공간이 남지 않도록 촘촘하게 말아준다. 반죽을 비닐에 싼 채로 냉장고에 넣어 1시간 이상 휴지시킨다.   냉장고에서 휴지시킨 반죽을 꺼내 1cm 두께로 썬다.   유산지를 깐 쿠키팬에 서로 붙지 않도록 일정한 간격을 두어 올리고 180℃로 예열한 오븐에 12~15분간 굽는다."
2,"겨울의 추운 몸을 달래주는 유자차.   유자의 향긋함과 따뜻함을 조금은 다르게 즐기실 수 있는 방법을 알려드립니다.   그 방법 첫번째로 유자향이 가득한 롤케이크 입니다.   따뜻한 커피와 함께 유자의 달콤함이 묻어있는 부드러운 롤케이크를 즐겨보세요.       달걀은 흰자와 노른자를 분리한다.     롤케이크팬에 유산지를 깐다.     냄비에 시럽용 물, 설탕을 넣어 끓이고 차갑게 식힌 후 럼주를 넣어 시럽을 완성한다.     오븐은 180℃로 10분간 미리 예열한다.   볼에 달걀 흰자를 넣고 핸드믹서의 거품기로 가장 센 단계에서 20초간 휘핑하다가    거품이 풍성해지면 설탕과 바닐라설탕을 조금씩 넣으며 윤기가 나고 단단한 머랭이 될 때까지 휘핑한다.   의 유자생크림을 스페츌러로 시트 위에 얇게 펴 바른다.   시트를 안쪽에서부터 둥글려가며 살짝 말아준 다음 유산지에 싸서 냉장고에 넣어 30분간 차갑게 식혀준다."
2,"겨울을 알리는 향기로운 유자는 겨울철에 찾게 되는 제철 과일입니다.   비타민 C가 풍부한 유자는 보통 차로 많이 즐기시지만   오늘은 식사대용으로도 좋은 비스켓에 유자와 크랜베리를 더했습니다.   이번 주말은 만들기도 간단한 유자베리스콘을 만들어보세요.         쿠키팬에 유산지를 깐다.     오븐은 180℃로 10분간 미리 예열한다.   푸드프로세서에 강력분, 박력분, 베이킹파우더, 설탕, 바닐라설탕을 넣고 가볍게 갈아준다.   차가운 버터를 깍둑썰기하여 넣고 고슬고슬한 상태가 될 때까지 갈아준다.   푸드프로세서에 유자청을 넣고 고슬고슬한 상태 까지 반죽을 뭉쳐준다.   푸드프로세서에 크랜베리를 넣고 다시 한 번 가볍게 뭉쳐준다.   반죽을 비닐에 올리고 손으로 눌러가며 하나의 반죽으로 뭉친다. 뭉친 반죽은 냉장고에 넣어 30분간 휴지시킨다.   휴지한 반죽을 두께 2cm가 되도록 밀대로 밀어 핀 후, 지름 5cm 원형커터로 반죽을 찍어낸 다음 유산지를 깐 팬에 간격을 띄어 올린다."
2,"요즘 유명한 제과점 이곳 저곳에서 에클레어를 쉽게 접해보실 수 있습니다.    에클레어는 모양도 맛도 사랑스러운 과자죠.    빼빼로데이를 맞이해서 쉽게 만들 수 있는 에클레어를 소개합니다.    속에 커스터드 크림이나 초코크림을 채워서 드시면 더 맛있게 즐기실 수 있습니다.       버터와 반죽용 달걀은 실온에 30분 이상 둔다.     쿠키팬에 유산지를 깔아 둔다.     오븐은 200℃로 15분간 예열한다.   냄비에 물, 버터, 소금을 넣은 다음 중불에서 버터가 녹고 물이 끓어오를 때까지 끓인다.   불에서 내린 다음 2회 체에 내린 뒤 박력분을 다시 체에 내려 넣고, 반죽이 뭉치지 않도록 실리콘 주걱으로 가볍게 섞어 하나의 덩어리로 만든다.   냄비를 중불에 올리고 앞뒤로 반죽을 굴리며 1분간 열을 가한다. 반죽을 볼에 옮겨 담고 1~2분간 한김 식힌다.   반죽에 달걀을 1개씩 넣으며 잘 섞이도록 핸드믹서 반죽기로 가장 약한 단계에서 1분간 반죽한다.   깍지를 끼운 짤주머니에 반죽을 넣고, 유산지를 깐 쿠키팬에 간격을 띄어 길이 10~15cm 정도가 되도록 짠다.   반죽 표면에 스프레이로 물을 충분히 뿌린다. 달걀물을 바르고 포크로 무늬를 낸다.    200℃로 예열한 오븐에 20~25분간 굽고 식힘망에 얹어서 충분히 식힌다.   중탕한 초콜릿에 완성된 에클레어를 담가 ⅔부분을 코팅한다.   초콜릿이 굳기 전에 장식용 피스타치오, 헤즐넛, 딸기다이스로 장식한다."
2,"사랑과 우정을 나누는 빼빼로데이날 특별한 빼빼로를 만들어보세요.    귀여운 모양의 빼빼로를 만들어 아이들과 친구들에게 소중한 추억을 나눠주세요.     일회용 짤주머니에 가나슈크림을 담고 밀크쉘과 화이트쉘에 70% 정도 크림을 채운다.   빼빼로스틱을 꽂고 냉장고에서 10분간 굳힌다.   중탕으로 녹인 장식용 초콜릿에 이 굳으면 녹인 초코펜을 이용해 커버처 초콜릿을 붙여 귀를 만든다.   초코펜을 이용해 눈, 코, 입을 그려 완성한다."
